{
  "id": "backstroke",
  "nameKeys": {
    "enGB": "swim.stroke.backstroke.name",
    "uk": "swim.stroke.backstroke.name"
  },
  "code": "backstroke",
  "summaryKey": "swim.stroke.backstroke.summary",
  "evidenceRefs": [
    {
      "kind": "doi",
      "id": "10.1249/MSS.0b013e318213fefb",
      "label": "Garber et al. 2011 ACSM — quantity/quality of exercise",
      "supports": [
        "endurance",
        "technique",
        "safety"
      ]
    }
  ]
}
